[
  {
    "bounds": {
      "max": [
        -0.25,
        -0.25,
        0.1
      ],
      "min": [
        -0.75,
        -0.75,
        0.0
      ]
    },
    "element_ids": [
      "surface_wall"
    ],
    "id": "base_surface_lod0",
    "lod": 0
  },
  {
    "bounds": {
      "max": [
        0.35,
        -0.2,
        0.8
      ],
      "min": [
        -0.15,
        -0.7,
        0.0
      ]
    },
    "element_ids": [
      "soft_volume"
    ],
    "id": "base_volume_lod0",
    "lod": 0
  },
  {
    "bounds": {
      "max": [
        0.95,
        -0.2,
        0.15
      ],
      "min": [
        0.45,
        -0.7,
        0.0
      ]
    },
    "element_ids": [
      "woven_frequency"
    ],
    "id": "detail_gabor_lod1",
    "lod": 1
  },
  {
    "bounds": {
      "max": [
        -0.25,
        0.55,
        0.2
      ],
      "min": [
        -0.75,
        0.05,
        0.0
      ]
    },
    "element_ids": [
      "view_residual"
    ],
    "id": "residual_neural_lod1",
    "lod": 1
  },
  {
    "bounds": {
      "max": [
        0.35,
        0.5,
        0.2
      ],
      "min": [
        -0.1,
        0.05,
        0.0
      ]
    },
    "element_ids": [
      "semantic_object"
    ],
    "id": "semantic_object_lod0",
    "lod": 0
  },
  {
    "bounds": {
      "max": [
        0.8,
        0.35,
        0.15
      ],
      "min": [
        0.5,
        0.05,
        0.0
      ]
    },
    "element_ids": [
      "compact_detail"
    ],
    "id": "detail_beta_lod1",
    "lod": 1
  },
  {
    "bounds": {
      "max": [
        1.05,
        0.5,
        0.2
      ],
      "min": [
        0.85,
        0.3,
        0.0
      ]
    },
    "element_ids": [
      "gaussian_fallback"
    ],
    "id": "fallback_gaussian_lod2",
    "lod": 2
  }
]
